{"schema":"csm-artifact/1","artifact":{"artifactId":"art-final-review-7aefc81cc340ede2295111d59c67e1ee","kind":"orchestrate-final-review","owner":"csm-release-reviewer-g1","runId":"run-7aefc81cc340ede2295111d59c67e1ee","digest":"sha256:8f1e81357939b04c8c4be3604243d6ee6fcaab7aa193055f4eaec92c58268211","createdAt":"2026-09-05T09:49:01.521Z","revision":1},"contentType":"application/json","lifecycleStatus":"completed","location":"review-artifact-run-7aefc81cc340ede2295111d59c67e1ee.json","sourceDigest":"sha256:f0032e25d3dd9733e275d31339d3c85c32354fff04da5fdc23303128aaedd542","sourceRunId":"run-7aefc81cc340ede2295111d59c67e1ee","sourceArtifactIds":["art-final-review-7aefc81cc340ede2295111d59c67e1ee"],"payloadDigest":"sha256:c5a13db47f7d9754e700e9c373b610577784ce61a6d6e4ca6c940f1c23b0042d","descriptorDigest":"sha256:4521e5d05dfb8a465322530fc749b223368ed53e6e41ce788512331a6555eb96"}
